{
  "$schema": "cotc-enterprise-V1.0.json",
  "@cotc": "enterprise_contract",
  "version": "2.2",
  "contract_id": "uuid",
  "metadata": {
    "name": "string",
    "description": "string",
    "created_by": "string",
    "created_at": "ISO8601",
    "last_modified": "2025-06-11T00:00:00Z",
    "tags": ["example", "template"],
    "security_classification": "internal"
  },
  "governance": {
    "contract_type": "compliance",
    "severity": "medium",
    "compliance_requirements": ["SOX", "HIPAA", "PCI_DSS", "GDPR"],
    "stakeholders": [
      {
        "role": "compliance_officer",
        "contact": "compliance@company.com",
        "notification_required": true,
        "approval_required": false,
        "escalation_level": "primary"
      }
    ],
    "sla_requirements": {
      "resolution_time": "24_hours",
      "escalation_triggers": [
        {
          "condition": "time_exceeded",
          "escalation_target": "manager@company.com",
          "notification_method": "email"
        }
      ]
    },
    "audit_metadata": {
      "business_impact": "compliance",
      "regulatory_mapping": ["SOX-404", "HIPAA-164.312"],
      "risk_classification": "medium",
      "data_sensitivity": "internal"
    }
  },
  "scope": {
    "technical_scope": {
      "files": ["src/**/*.ts"],
      "directories": ["src/", "tests/"],
      "environments": ["production"],
      "systems": ["web-application"]
    },
    "business_scope": {
      "departments": ["string"],
      "business_units": ["string"],
      "geographic_regions": ["string"]
    }
  }
}
